{
  "version": "0.1.0",
  "generated_at": "2025-08-30T08:30:52.818745700+00:00",
  "modules": {
    "test_basic.py": {
      "module_name": "test_basic",
      "is_package": false,
      "is_namespace": false,
      "parent_package": null,
      "relative_path": "test_basic.py",
      "digest": "f3b9270876e546c4dde54822110148a6fc281f8b5e0614cf260f0547791a69aa"
    },
    "calculator.py": {
      "module_name": "calculator",
      "is_package": false,
      "is_namespace": false,
      "parent_package": null,
      "relative_path": "calculator.py",
      "digest": "27d43b22a21d5e0657d6a85e09b22e8562e808982a70bc1fbf83c7735620774c"
    },
    "conftest.py": {
      "module_name": "conftest",
      "is_package": false,
      "is_namespace": false,
      "parent_package": null,
      "relative_path": "conftest.py",
      "digest": "7ace5556321eec9b80156a3f337f101629d8aa9a14c7e85cb1d048b81f1c97b0"
    },
    "test_calculator.py": {
      "module_name": "test_calculator",
      "is_package": false,
      "is_namespace": false,
      "parent_package": null,
      "relative_path": "test_calculator.py",
      "digest": "bb4a7aa98d984f0c3200da0ecd87aaed43fea817b82a215e7532b5f0f58badb2"
    }
  },
  "packages": []
}